id,title,content,question,answer
19,sommeil_paradoxal,"Cet article est une  ébauche  concernant la  médecine .  Vous pouvez partager vos connaissances en l’améliorant ( comment? ) selon les recommandations des  projets correspondants . Le  sommeil paradoxal , connu également comme le sommeil REM ( Rapid Eye Movement ), fait suite au sommeil lent («sommeil à ondes lentes» désignant les stades 3 et 4), et constitue le cinquième et dernier stade d'un cycle du  sommeil . Une «nuit» comprend de trois à six cycles successifs d'une durée chacun de 90 à 120 minutes. Chez une personne normale, la durée du sommeil paradoxal occupe environ 25% de la durée d'une nuit, et s'accroît à chaque cycle jusqu'au réveil [ 1 ] . C'est la phase du sommeil au cours de laquelle les  rêves  dont on se souvient se produisent. Il se caractérise par des  mouvements oculaires rapides , d'où le nom anglais  Rapid Eye Movement , une  atonie  musculaire, une  respiration  et un  rythme cardiaque  irréguliers, une  température corporelle  déréglée. On observe une dilatation des organes  pelviens  et une  érection  qui, chez le mâle, peut être suivie d'éjaculations. L'activité électrique du cerveau est proche de celle de l'éveil, comme le montre le tracé  électro-encéphalographique . On l'observe non seulement chez l'être humain mais aussi chez la majorité des  mammifères   placentaires , chez les  oiseaux  et chez certains  reptiles  (lézards [ 2 ] ). Son déclenchement peut être observé par le placement d' électrodes  au niveau du  pont , du  corps géniculé  et du  cortex visuel  (parfois appelé cortex occipital).",Qu'est ce que le sommeil paradoxal ?,"{'text': 'la phase du sommeil au cours de laquelle les  rêves  dont on se souvient se produisent', 'answer_start': 668}"
20,Espèce,"Cet article concerne le sens biologique du mot «espèce». Pour les autres significations, voir  Espèce (homonymie) . Dans les  sciences du vivant , l’ espèce  (du  latin   species , «type» ou «apparence») est le  taxon  de base de la  systématique . La définition le plus communément admise est celle du concept biologique [ 1 ] , [ 2 ] , [ 3 ] : une espèce est un ensemble d'individus qui peuvent effectivement ou potentiellement se reproduire entre eux et engendrer une descendance viable et féconde, dans des conditions naturelles. Une publication de 1997 recense cependant  22 concepts  d'espèces (espèce biologique, morphologique, écologique, comportementale…) dans la  littérature scientifique [ 4 ] . Ainsi, l'espèce est la plus grande unité de population au sein de laquelle le flux génétique est possible et les individus d'une même espèce sont donc génétiquement isolés d'autres ensembles équivalents du point de vue reproductif. En particulier, le critère d’interfécondité ne peut pas toujours être vérifié: c'est le cas pour les  fossiles , les  organismes   asexués  ou pour des espèces rares ou difficiles à observer. D’autres définitions peuvent donc être utilisées [ 5 ] :",Quelles sont les origines latines du mot espèce ?,"{'text': 'du latin species , «type» ou «apparence»', 'answer_start': -1}"
21,Chat_(animal),"Pour les articles homonymes, voir  Chat (homonymie) . Taxons concernés modifier   Chat  est un terme ambigu employé en français pour désigner de nombreux  félins  de taille moyenne ou petite, appartenant à la  sous-famille  des  félinés . Employé seul, il s'agit du  nom vernaculaire  donné au  chat domestique  ( Felis silvestris catus ). Par  synecdoque , chat peut désigner l'ensemble des  félins : l'expression « chat sauvage » s'applique à plusieurs espèces ou sous-espèces de petits félins, tandis que la  sous-famille  des  Panthérinés  est parfois désignée par l'expression  «grands chats» .",De quelles taille est le cha t? ,"{'text': 'de taille moyenne ou petite', 'answer_start': 163}"
22,Synonymes,"Pour les articles homonymes, voir  Synonymie . Dans la  nomenclature scientifique  du monde vivant, les  synonymes  sont des noms scientifiques différents pour désigner un même  taxon . Ils sont la conséquence des remaniements, parfois très nombreux, apportés par les scientifiques à la  classification scientifique des espèces  (genres fusionnés, sous-espèces promues au rang d'espèce, doublons, coquilles, etc. ). Les autorités, dates et éléments de typographie associés sont indispensables à prendre en compte pour éviter les confusions et leur interprétation varie selon les codes de nomenclature [ 1 ] . Le nom scientifique validé en dernier n'est pas forcément celui qui a été publié le plus récemment. Par exemple  Hyperolius viridiflavus  admet de nombreux synonymes, dont les derniers sont postérieurs à 1970, alors que le nom actuellement valide [ a ]  est « Hyperolius viridiflavus  (Duméril and Bibron, 1841)» [ 4 ] .",Qu'est ce qu'on synonyme dans la nomenclature scientifique ?,"{'text': 'des noms scientifiques différents pour désigner un même taxon', 'answer_start': -1}"
23,bas_latin,"Cet article est une  ébauche  concernant la  Rome antique  et une  langue .  Vous pouvez partager vos connaissances en l’améliorant ( comment? ) selon les recommandations des  projets correspondants .  Le  bas latin , ou  latin tardif , est le  latin  de l’ Antiquité tardive , habituellement les versions du latin parlées du  III e  au  VI e siècle (voire jusqu'au  VII e siècle en Espagne).",De quelle époque vient le bas latin ? ,"{'text': 'Antiquité tardive', 'answer_start': 258}"
24,organe_de_Jacobson,"L’ organe voméronasal  (ou  «OVN»  ou  organe de Jacobson ) est un  organe  tubulaire situé chez l'humain sous la surface intérieure du  nez . Chez les  mammifères , cet organe est spécialisé dans la détection des  phéromones , qui sont des  molécules  véhiculant des signaux  innés . Ces signaux permettent de réguler les comportements sociaux (comportements sexuel, parental, d'agression …). Suivant les espèces, il existe des différences anatomiques. Les phéromones arrivent à l'organe voméronasal soit par la bouche (par léchage ou  flehmen ), soit par le nez, soit par le canal nasopalatin (qui relie la bouche et le nez). Chez les  Catarrhiniens  ( Macaques ,  Babouins , et  Hominidés ), le système voméronasal est  vestigial . Chez l'être humain, l'organe voméronasal n'est quasiment plus fonctionnel, le  bulbe olfactif accessoire  est atrophié, et le canal nasopalatin est généralement obturé [ 1 ] .",Où se situe l'organe de Jacobson ?,"{'text': 'sous la surface intérieure du nez', 'answer_start': -1}"
25,pedigree,"Pour les articles homonymes, voir  Pedigree (homonymie) . Cet article est une  ébauche  concernant la  généalogie .  Vous pouvez partager vos connaissances en l’améliorant ( comment? ) selon les recommandations des  projets correspondants . Cet article  ne cite pas suffisamment ses sources   ( février 2021 ).  Si vous disposez d'ouvrages ou d'articles de référence ou si vous connaissez des sites web de qualité traitant du thème abordé ici, merci de compléter l'article en donnant les  références utiles à sa  vérifiabilité  et en les liant à la section « Notes et références ». En pratique:   Quelles sources sont attendues?   Comment ajouter mes sources?  Le  pedigree  (parfois écrit  pédigrée ) est, chez les animaux, une liste d'ancêtres de la même  espèce  garantissant la pureté de la race. En France, pour les  chiens , on peut obtenir un extrait du  Livre des origines français  (LOF), équivalent d'un extrait d'état civil, qui certifie la  généalogie  d'un chien de race. Pour les chats, il s'agit du  Livre officiel des origines félines  (LOOF). Chez le lapin, le pedigree garantit la race aussi bien que sa pureté. Dans le langage courant, le terme «pedigree» est aussi utilisé pour tout ce qui a rapport à l'histoire d'une lignée distinguée. On s'en sert pour démontrer que l'animal vendu n'a aucun lien de parenté sur plusieurs générations si l'éleveur le désire.",Que garantie le pédigrée ?,"{'text': 'la pureté de la race', 'answer_start': 779}"
26,vue,"Pour les articles homonymes, voir  Vue (homonymie) . La  vue  est le  sens  qui permet de réagir à l'environnement distant au moyen des  rayonnements lumineux . L' œil  est l'organe de la  vue , mais la vision, c'est-à-dire la  perception  visuelle, implique des zones spécialisées du  cerveau . Le  cortex visuel  synthétise les  influx nerveux  et les  traces mémorielles  des  expériences  visuelles passées pour identifier des formes, des  couleurs , des textures, des  reliefs . La plupart des espèces vivantes animées possèdent un sens de la vue, dont les caractéristiques, variées, dépendent de leur environnement.",Grâce à quoi est-il possible d'interagir avec l'environnement ?,"{'text': 'rayonnements lumineux', 'answer_start': 137}"
27,Prédateur,"Pour les articles homonymes, voir  Prédateur (homonymie) . La  prédation  est l'action de prendre, de capturer.",Quelle action produit un prédateur ?,"{'text': ""l'action de prendre, de capturer"", 'answer_start': 78}"
28,phéromones,"Une  phéromone  (ou phérormone ou encore phérohormone) est une  substance chimique  émise par la plupart des  animaux  et certains  végétaux , et qui agit comme un message entre les individus d'une même  espèce  (communication intraspécifique, à l'opposé des  ectomones  impliquées dans la  communication interspécifique ). Ce composé  sémiochimique  transmet aux autres organismes des informations qui influencent la physiologie et les comportements (sexuel, maternel, agression,  agrégation , pistage…) [ 1 ] . Très actives, certaines phéromones agissent même en faible quantité, et elles peuvent être transportées et être détectées à plusieurs kilomètres. Chez les  mammifères  et les  reptiles , les phéromones sont principalement détectées par l' organe voméronasal , tandis que les  insectes  utilisent généralement leurs  antennes . À la différence des hormones  classiques  ( insuline ,  adrénaline , etc.) produites par les  glandes endocrines  et qui circulent uniquement à l'intérieur de l'organisme en participant à son  métabolisme , les phéromones sont généralement produites par des glandes exocrines, ou sécrétées avec l' urine , et servent de messagers chimiques entre individus. Elles peuvent être volatiles (perçues par l' odorat ), ou agir par contact ( composés cuticulaires  des insectes par exemple, perçues par les récepteurs gustatifs). Elles jouent un rôle primordial lors des périodes d'accouplement, et chez certains  insectes sociaux , telles les  fourmis  ou les  abeilles . Ces phéromones sont indispensables au bon fonctionnement du groupe. Les phéromones sexuelles des insectes contribuent à l'isolement reproducteur entre les espèces grâce à leur spécificité. L'existence des phéromones dans l'espèce humaine est un sujet controversé. De nombreux biais scientifiques et sociopsychologiques rendent complexe l'étude des effets psychologiques des odeurs, parfums ou phéromones sur les  émotions  et les comportements des humains [ 2 ] , [ 3 ] . En particulier, il est souvent très difficile de distinguer les nombreux effets olfactifs appris des véritables effets phéromonaux innés [ 4 ] . Chez l'humain, les structures olfactives sont  vestigiales  et les phéromones n'ont plus que des effets faibles [ 5 ] , [ 4 ] . Grâce aux techniques  biochimiques , il est possible de produire des phéromones de synthèse. Elles sont utilisées par l' industrie cosmétique , souvent dans des  parfums , avec des présentations commerciales qui suggèrent des effets sexuels et affectifs [ 6 ] , malgré l'absence de données expérimentales valides [ 5 ] , [ 4 ] . Des phéromones de synthèse, respectueuses de l'environnement, peuvent également être utilisées pour la protection des cultures comme produit de remplacement des insecticides. ",Par quoi sont produites les phéromones ?,"{'text': 'des glandes exocrines', 'answer_start': 1094}"
30,chats_harets,"Le  chat haret , ou  chat errant , est un  chat domestique  (petit  félin  de la  sous-espèce   Felis silvestris catus ), retourné à l' état sauvage  ou  semi-sauvage , par le phénomène du  marronnage . Il a pu vivre en compagnie d' êtres humains  au cours de son existence, avant de fuir ou d'être abandonné, ou bien être né loin d'eux, en étant issu d'une lignée dont le retour à l'état sauvage remonte à plusieurs générations. De sorte que la différence entre le chat haret et le chat domestique proprement dit n'est pas  génétique , mais uniquement  éthologique , c'est-à-dire liée à son mode de vie. Le chat haret ne doit donc pas être confondu avec les autres sous-espèces, naturelles, du  Chat sauvage  ( Felis silvestris ), comme le  Chat sauvage d'Europe  ( Felis silvestris silvestris ) ou le  Chat sauvage d'Afrique  ( Felis silvestris lybica ), ni avec les autres  espèces appelées  chat . Dans certains pays, où le chat n'est pas une espèce d'origine indigène, les populations de chats harets ont proliféré; ils représentent en  Australie  une population évaluée entre 2,1et 6,3millions de chats fin 2016  [ 1 ] , [ 2 ] , qui pose de graves problèmes environnementaux.",A quoi est lié la différence entre le chat haret et le chat domestique ?,"{'text': 'éthologique', 'answer_start': 554}"
31,City_University_of_London,"modifier  -  modifier le code  -  modifier Wikidata City, University of London  est une  université britannique  publique située à  Londres  ( Angleterre ), dans le quartier  Clerkenwell , et fondée en  1894 .En  septembre 2016 , City a rejoint  University of London  (UOL) [ 1 ] .",Quand a été fondée la City Université of London ?,"{'text': 'en 1894', 'answer_start': -1}"
32,race,"«Racial» redirige ici. Pour l’article homophone, voir  Rassial . Cet article concerne le concept de race en zoologie. Pour les articles homonymes, voir  race (homonymie) . Pour l'application du concept à l'espèce humaine, voir  race humaine . Chez les  animaux domestiques , la  race  est un  rang taxinomique  informel, inférieur à l' espèce . Les races et les  sous-races  sont distinguées à des fins d' élevage  et de  sélection . On parle ainsi de races  bovines ,  canines ,  félines , ou  caprines . Les  taxons  au rang de race n'ont pas de  noms scientifiques  internationaux [ 1 ] , leur circonscription  taxinomique  repose généralement sur des critères subjectifs et pratiques (notamment utilisés pour la désignation commerciale) [ 2 ] . Ces variations sont généralement très faibles pour les races sélectionnées afin de veiller à un certain standard, dont on exige par exemple des prestations particulières pour satisfaire de façon optimale à un but d'utilisation. Par contre, la variabilité peut être très importante entre races géographiques. Il s'agit d'un concept lié à l'aspect commercial davantage que scientifique. Cet article concerne plus particulièrement l'acception du mot «race» pour désigner des groupes d'une même espèce animale. En  nomenclature botanique et mycologique  où le terme de «race» n'est pas un rang taxinomique  codifié , on parle de  variété  ou de  sous-espèce [ 3 ] . Il reste cependant possible d'utiliser le mot de «variété animale» [ 4 ]  domestique pour désigner une population animale sélectionnée constituée d'une fraction des animaux d'une espèce que des traitements particuliers de sélection ont eu pour effet de distinguer des autres animaux de l'espèce par un petit nombre de caractères dont l'énumération définit le modèle. En  microbiologie  et en  virologie , on parle plutôt de  souche  afin de désigner au sein d'une même espèce microbienne, une population divergeant du reste de l'espèce sur un ou quelques traits différentiels (ex.: une souche de  Escherichia coli  pathogène pour l'homme, alors que la majorité des populations de cette espèce ne le sont pas). Pour les espèces naturelles, les termes sous-espèce ou  population  (selon la divergence et le groupe considéré) sont utilisés [réf.nécessaire] . L'utilisation de critères biologiques prétendant définir différentes «races» humaines au sein de l' espèce humaine  soulève des questions  éthiques  et même logique (on ne vend pas aujourd'hui les hommes dans les pays développés et une désignation commerciale y est donc sans objet). Les controverses sur ce sujet ne sont pas développées ici mais dans l'article  Race humaine .",Dans quel but sont distinguées les races et les sous-races ?,"{'text': ""à des fins d' élevage et de sélection"", 'answer_start': -1}"
34,glandes_sudoripares,"Cet article est une  ébauche  concernant l’ anatomie .  Vous pouvez partager vos connaissances en l’améliorant ( comment? ) selon les recommandations des  projets correspondants . Les  glandes sudoripares  ou  glandes sudorales  sont des annexes cutanées ( organes microscopiques  spécialisés) qui sécrètent la  sueur  et, pour certaines d'entre elles, des  hormones  ou  phéromones . Histologiquement, il s'agit de  glandes exocrines  ( épithéliums  cubiques bistratifiés) dont la fonction première est la  transpiration . On distingue chez les mammifères trois types de glandes sudoripares: les glandes eccrines, les glandes apocrines et les glandes sébacées. Ces deux dernières constituent les deux principaux types.",Quelle est la fonction première des glandes sudoripares ?,"{'text': 'la transpiration', 'answer_start': -1}"
35,carnivore,"Pour les articles homonymes, voir  Carnivore (régime alimentaire)  et  Carnivore domestique . Ordre Sous-ordres  de rang inférieur Les  Carnivores  ( Carnivora ) sont un  ordre  de  mammifères   placentaires  du  super-ordre  des  Laurasiathériens . Ils se distinguent par une  mâchoire  et une  denture  qui leur permet de chasser et de manger d'autres animaux. Une des  synapomorphies  qui caractérisent les Carnivores est la présence d'une  carnassière . Les  canines  sont transformées en crocs. Leur cerveau est de type  gyrencéphale . Cet ordre est composé majoritairement d'animaux rapides au  régime alimentaire   carnivore  (chair crue), bien qu'il existe certains membres qui n'ont pas ce régime, tels le  panda géant  qui est  herbivore  et des  omnivores  opportunistes comme le  Renard roux  ou le  Binturong  qui est principalement  frugivore . D'autre part, les  mammifères  carnassiers ne sont pas tous forcément membres de cet ordre. On peut ainsi citer, par exemple, le  dasyure , le  thylacine , ou le  diable de Tasmanie , qui sont tous trois des  marsupiaux , ou bien certains  cétacés  tels que l' orque  ou le  grand cachalot .",Quelle est la forme des canines des carnivores ?,"{'text': 'en crocs', 'answer_start': 490}"
36,robe,"Pour les articles homonymes, voir  Robe . Cet article est une  ébauche  concernant la  zoologie .  Vous pouvez partager vos connaissances en l’améliorant ( comment? ) selon les recommandations des  projets correspondants . La  robe  d'un  animal  consiste en la nature et la qualité de sa  peau  ou de sa  pilosité .  La robe d'un animal, ou pelage, est une caractéristique complexe avec des bases scientifiques. La couleur est influencée par des pigments comme la mélanine et la phéomélanine.   La structure des poils varie, affectant la texture, et la fonction du pelage inclut l'isolation thermique, la camouflage et la protection. Les cycles de mue s'adaptent aux saisons, l'adaptation écologique peut influencer l'épaisseur du pelage, et la variabilité génétique, identifiée par des études, contribue à des différences intra et interspécifiques. Chez les  mammifères  de compétition, l'état de la robe est jugé en plusieurs catégories. Ces catégories peuvent inclure les  poils  longs ( jarre ), portant les marques de la robe et les poils plus courts ( bourre  ou  duvet )  [ 1 ] .La robe indique la qualité de l' élevage . Souvent, la robe est un facteur indispensable pour reconnaître une espèce ou une race.",Par quel pigments est influencé la couleur de la robe ?,"{'text': 'la mélanine et la phéomélanine', 'answer_start': 462}"
38,espèce,"Cet article concerne le sens biologique du mot «espèce». Pour les autres significations, voir  Espèce (homonymie) . Dans les  sciences du vivant , l’ espèce  (du  latin   species , «type» ou «apparence») est le  taxon  de base de la  systématique . La définition le plus communément admise est celle du concept biologique [ 1 ] , [ 2 ] , [ 3 ] : une espèce est un ensemble d'individus qui peuvent effectivement ou potentiellement se reproduire entre eux et engendrer une descendance viable et féconde, dans des conditions naturelles. Une publication de 1997 recense cependant  22 concepts  d'espèces (espèce biologique, morphologique, écologique, comportementale…) dans la  littérature scientifique [ 4 ] . Ainsi, l'espèce est la plus grande unité de population au sein de laquelle le flux génétique est possible et les individus d'une même espèce sont donc génétiquement isolés d'autres ensembles équivalents du point de vue reproductif. En particulier, le critère d’interfécondité ne peut pas toujours être vérifié: c'est le cas pour les  fossiles , les  organismes   asexués  ou pour des espèces rares ou difficiles à observer. D’autres définitions peuvent donc être utilisées [ 5 ] :",Chez qui le critère l'interfécondité ne peut pas toujours être vérifié ?,"{'text': 'les  fossiles , les  organismes   asexués  ou pour des espèces rares ou difficiles à observer', 'answer_start': 1036}"
39,vieillissement,"Le  vieillissement  est l'ensemble des modifications fonctionnelles diminuant progressivement l'aptitude d'un objet, d'une information ou d'un organisme à assurer ses fonctions dans le temps. Dans le cas d'un  organisme vivant  ( être humain  par exemple), la plupart des cellules et organes ont une durée de vie maximale génétiquement programmée, mais ce processus peut être accéléré par divers stress subis  in utero  ou durant la vie - qui conduisent le plus souvent [ 1 ]  cet organisme à ne plus assurer son équilibre  physiologique , ce qui le mène à la  mort . Chez l' Homme , le vieillissement est un processus complexe, lent et progressif, qui implique divers facteurs biologiques, psychologiques et sociaux. Ces facteurs sont en partie  génétiques  (vieillissement intrinsèque), et pour partie liés à l'histoire de vie de chacun (facteurs externes de vieillissement, acquis ou subis). Le vieillissement de certaines cellules commence dès la naissance, voire  in utero . Chez l'Homme, par convention, on parle de vieillissement à partir d'un certain âge (l’âge «mûr»), avant de différencier le  3 e âge (65 – 89 ans) du  4 e âge ou grand âge (> 90 ans). Sur le plan médical, les définitions chronologiques sont reléguées au second plan au profit de celles tenant compte du niveau de dépendance du sujet âgé. L'étude de la vieillesse et du vieillissement humain est la  gérontologie  (terme formé sur le mot  grec   geron, gerontos , «vieillard»). La  médecine  de la vieillesse est la  gériatrie .",Comment s'appelle l'étude de la vieillesse et du vieillissement humain ?,"{'text': 'la  gériatrie', 'answer_start': 1491}"
40,griffes,"Pour les articles homonymes, voir  Griffe . Une  griffe  est un élément pointu et courbé trouvé au bout des pattes ou doigts de certains  mammifères , des  oiseaux  et de certains  reptiles . Quelque part, une structure crochue similaire peut être trouvée chez les  arthropodes  tels que les  scarabées  ou les  araignées .  Les pinces des crabes et langoustes sont souvent nommées «griffes». [réf.nécessaire] ",Chez quels espèces les griffes se trouvent au bout des pattes ou doigts ?,"{'text': 'certains  mammifères , des  oiseaux  et de certains  reptiles', 'answer_start': 128}"
41,castré,"La  castration  est l'annihilation (avec ou sans  ablation ) des organes reproducteurs de végétaux ou d'animaux,  humains  compris. Dans le cas des humains, la castration est considérée comme une  mutilation génitale  et est illégale dans la plupart des pays du monde. On la distingue de l'ablation  chirurgicale  des  testicules  et des  ovaires  — orchidectomie  ou encore  orchiectomie  pour les mâles et  ovariectomie  ou  oophorectomie  pour les femelles— qui peut être nécessaire pour des raisons  thérapeutiques  et de la  castration chimique . La castration concerne dans le règne animal l'ablation des testicules (chez les mâles) et l'ablation des ovaires (chez les femelles), l'ablation de la verge étant appelée  pénectomie  et  clitoridectomie  pour le  clitoris . L'ablation de la  verge  et des  testicules  est une émasculation.",Comment s'intitule l'ablation de la verge et des testicules ?,"{'text': 'une émasculation', 'answer_start': 826}"
