id,title,content,question,answer
42,odorat,"L' olfaction  ou l' odorat  est le  sens  qui permet d'analyser les  substances chimiques   volatiles  ( odeurs ) présentes dans l’air. L'olfaction est un sens vital pour de nombreuses espèces [ 1 ] ; il est par exemple utile ou nécessaire pour les activités de recherche alimentaire (chasse, recherche de végétaux appétents, etc. ), l’évitement des  prédateurs , la localisation du lieu de nidification, ponte, reproduction, mise bas, etc. , pour la reconnaissance et le marquage du territoire, pour la communication entre individus par messages olfactifs, pour la recherche de partenaires sexuels, et pour la pollinisation des fleurs, etc.  Ce sens est moins utilisé chez l’ être humain  que chez de nombreux  mammifères  pour lesquels il est prépondérant, néanmoins, l' odeur personnelle  semble encore jouer un ou plusieurs rôles chez l'humain en termes de  communication non verbale [ 2 ] , à plusieurs âges de la vie, avec des nuances notamment selon le sexe (Homme/Femme) [ 3 ] , selon l'âge ou selon les contextes socio-culturels [ 4 ] , [ 5 ] . L' olfactique  est la science du langage des odeurs et de leur rôle dans cette communication non verbale [ 6 ] .",Quel est le deuxième nom pour qualifier l'olfaction ?,"{'text': ""l' odorat"", 'answer_start': 17}"
43,organe_vestibulaire,"Le  système vestibulaire  est un  organe sensoriel  situé dans l’ oreille interne  qui contribue à la sensation de mouvement et à l’ équilibre  chez la plupart des mammifères.Il est constitué d’un organe sensoriel périphérique composé du labyrinthe postérieur (canaux semi-circulaires, utricule et saccule), du  nerf vestibulocochléaire  et de ses noyaux encéphaliques. Les signaux sensoriels issus du système vestibulaire sont principalement envoyés aux structures neuronales qui commandent certains mouvements oculaires et muscles dans une optique posturale (maintien du corps dans son environnement). Les troubles du système vestibulaire peuvent conduire à des  vertiges  qui peuvent être pris en charge par kinésithérapie spécialisée. On peut comparer l’oreille interne à une  centrale inertielle .",A quoi peut-on comparer l'oreille interne ?,"{'text': 'à une  centrale inertielle', 'answer_start': 774}"
44,habitats,"Pour les articles homonymes, voir  Habitat . L' habitat  est un concept utilisé dans le domaine de l' écologie . Un habitat réunit l'ensemble des  êtres vivants  et leurs  interactions  ( biocénose ) et l'ensemble des éléments physiques ou chimiques ( biotope ). Certaines  espèces clés ou facilitatrices  jouent un rôle dans la création et l'entretien de l'habitat ( coraux  pour les  récifs coralliens  par exemple). L'habitat est aussi un ensemble d'éléments de l' écologie du paysage  qui constituent l' environnement biophysique  et offrent les  ressources naturelles  suffisantes pour permettre à une population d'une espèce de vivre et se reproduire normalement sur ce territoire. Certains auteurs estiment qu'un habitat (parce qu'il évolue) n'implique pas une viabilité à long terme pour l'espèce qui y vit, mais au moins une viabilité à court terme [ 1 ] . La notion d'habitat est utilisée pour décrire (et éventuellement cartographier) l'endroit et les caractéristiques du «milieu» dans lequel une  population  d'individus d'une espèce donnée (ou d'un groupe d'espèces  symbiotes  ou vivant en  guilde ) peut normalement vivre et s'épanouir. Il faudrait plutôt parler de  l'habitat d'une population  plutôt que d'une espèce ou d'un «organisme», car s'il est par exemple possible de décrire précisément l'habitat d'un seul  ours dans les Pyrénées , l'espèce  Ursus arctos  devrait être constituée d'une « métapopulation » divisée en nombreux groupes d'individus (sous-populations) vivant dans des habitats plus variés que ceux dans lesquels les derniers individus de cette espèce tentent de survivre; cette espèce était autrefois commune dans toute l'Europe, des littoraux aux basses-montagnes. En ce qui concerne les  biotopes , les Pyrénées ne sont en rien représentatives de l'habitat optimal. Ils ne constituent que leur dernier refuge, celui où ils ont été le moins traqués et chassés. [réf.nécessaire] ",Dans quel domaine est utilisé le concept d'habitat ?,"{'text': ""l' écologie"", 'answer_start': 99}"
45,nuque,"Cet article est une  ébauche  concernant l’ anatomie  et la  médecine .  Vous pouvez partager vos connaissances en l’améliorant ( comment? ) selon les recommandations des  projets correspondants . La  nuque  est la partie postérieure du  cou , située au-dessous de l' occiput . Elle correspond à la partie dorsale du cou, c'est-à-dire la région du cou située en arrière d'un plan frontal passant par les processus transverses des  vertèbres cervicales . Ces dernières vertèbres y sont recouvertes par les  muscles trapèzes .",Ou se situe la partie dorsale du cou ?,"{'text': ""en arrière d'un plan frontal passant par les processus transverses des vertèbres cervicales"", 'answer_start': -1}"
47,ronronnement,"Vous lisez un « article de qualité » labellisé en 2010. Pour un article plus général, voir  Chat .  Le  ronronnement  est une  vocalisation  émise par certains  félins  et  viverridés . Produit à l’expiration comme à l’inspiration, ce son de basse fréquence apparaît dès l’âge de deux jours. Le mécanisme du ronronnement est encore mal expliqué. La théorie dominante est que le son est produit par des contractions des muscles du  larynx  déclenchées par une  oscillation neurale  et faisant vibrer les  cordes vocales . La possibilité pour un félin de ronronner ou non est également un point débattu, notamment pour les grands félins de la  sous-famille  des  Panthérinés . Le ronronnement est essentiellement limité aux relations mère-progéniture dans la nature, mais le  chat domestique  peut ronronner tant dans une situation de  plaisir  que de  souffrance , c’est pourquoi la signification de cette vocalisation de contact est peu évidente. Comparé au  sourire  par certains auteurs, son rôle social, tant avec des congénères qu’avec l’ Homme , est primordial. Une théorie assure au ronronnement un rôle  curatif : les basses fréquences émises permettraient de renforcer les os, les muscles, les tendons et auraient même un rôle anti- douleur . En français, les termes associés au mot  «ronronnement»  sont tirés de l’ onomatopée   «ronron» .",Quel est l'onomatopée du ronronnement ?,"{'text': 'ronron', 'answer_start': 104}"
48,argot,"Pour les articles ayant des titres homophones, voir  Argo  et  Hargot . Cet article possède un  paronyme , voir  largo . Un  argot  est une variété linguistique spécifique à un groupe social ou socio-professionnel, qui permet de se différencier des non-initiés et de se créer une identité propre en utilisant des termes cryptiques [ 1 ] , [ 2 ] . Il s'agit d'un  sociolecte  qu'il faut distinguer du  jargon , qui est propre aux représentants d'une profession ou d'une activité commune se caractérisant par un lexique spécialisé [ 3 ] . Il est possible que des termes argotiques perdent leurs fonctions cryptique et identitaire. Dans ces cas-là, il ne sera plus vraiment spécifique à un groupe mais surtout utilisé dans une visée ludique. Le nouvel argot qui s’en crée est dénommé «argot commun». Les locuteurs et locutrices «jouent» à reproduire un  parler  largement  connoté . En général, l’argot commun reprend du vocabulaire argotique «dépassé», abandonné par le groupe social qui en est l’origine dès qu’il a été compris par des tiers. Un exemple d’argot commun est le «français branché» des années 1980.",Qu'est-ce qu'un argot ?,"{'text': 'une variété linguistique spécifique à un groupe social ou socio-professionnel, qui permet de se différencier des non-initiés et de se créer une identité propre en utilisant des termes cryptiques', 'answer_start': 136}"
49,bon_article,"En résumé:  un  bon article  doit faire honneur à Wikipédia par ses qualités intrinsèques, quel que soit le sujet traité. Pour cela, les points suivants seront respectés autant que possible. Le label « Bon article » regroupe les articles qui ont été reconnus comme tels par un vote de la communauté. La proposition d'un article au label se fait sur la page  Wikipédia:Bons contenus/Propositions . Les articles proposés comme « Articles de qualité » peuvent aussi être reconnus «Bons articles» s'ils n'obtiennent pas le label « Article de qualité ». Nota bene:  ces éléments sont des critères généraux permettant d'établir (ou de contester) la  qualité d'un bon article  susceptible d'être ainsi distingué des autres; il reste néanmoins nécessaire d'exercer un esprit de finesse au cas par cas, pour examiner dans quelle mesure tel critère doit s'appliquer avec rigueur ou avec souplesse. En outre, il est toujours préférable de corriger soi-même des défauts mineurs que d'en faire un argument contre la promotion d'un article.","C'est quoi un label ""Bon article""","{'text': 'les articles qui ont été reconnus comme tels par un vote de la communauté', 'answer_start': 225}"
50,1560,"Cette page concerne l'année  1560   du  calendrier julien . Pour l'année 1560 av. J.-C., voir  1560 av. J.-C.  Architecture ,  Arts plastiques  ( Dessin ,  Gravure ,  Peinture  et  Sculpture ) ,  Littérature  ()  et  Musique classique  () ,  Architecture  et  ()  Droit  (,)  ()  et  Santé et médecine  modifier   L'année  1560  est une  année bissextile  qui  commence un lundi .",L'année 1560 commence par quel jour ?,"{'text': 'un lundi', 'answer_start': 370}"
